{
  "panel_name": "security-review",
  "panel_version": "1.0.0",
  "confidence_score": 0.88,
  "risk_level": "low",
  "compliance_score": 1.0,
  "policy_flags": [],
  "requires_human_review": false,
  "timestamp": "2026-02-21T22:00:00Z",
  "findings": [
    {
      "persona": "compliance/security-auditor",
      "verdict": "approve",
      "confidence": 0.90,
      "rationale": "Governance configuration repo — no application code, no secrets, no user input handling. Policy profiles use YAML with no dynamic evaluation. Schema files are static JSON Schema definitions."
    },
    {
      "persona": "operations/infrastructure-engineer",
      "verdict": "approve",
      "confidence": 0.88,
      "rationale": "CI workflows use pinned action versions. GitHub token scoped to minimum required permissions. No external service credentials stored in repo."
    },
    {
      "persona": "compliance/compliance-officer",
      "verdict": "approve",
      "confidence": 0.85,
      "rationale": "Policy profiles enforce SOC2/PCI-DSS/HIPAA/GDPR compliance postures. Audit trail maintained via run manifests. No PII stored in governance artifacts."
    }
  ],
  "aggregate_verdict": "approve",
  "execution_context": {
    "repository": "SET-Apps/ai-submodule",
    "policy_profile": "default",
    "model_version": "claude-opus-4-6",
    "triggered_by": "manual"
  }
}
