{
  "panel_name": "documentation-review",
  "panel_version": "1.0.0",
  "confidence_score": 0.66,
  "risk_level": "low",
  "compliance_score": 0.75,
  "policy_flags": [
    {
      "flag": "non_mermaid_diagram",
      "severity": "high",
      "description": "Architecture diagram in docs/architecture/orchestrator.md (lines 14-32) uses ASCII box-drawing characters instead of mermaid. Documentation standards require all diagrams to use mermaid code blocks.",
      "remediation": "Convert the ASCII architecture diagram to a mermaid block diagram or flowchart.",
      "auto_remediable": true
    },
    {
      "flag": "inaccurate_line_counts",
      "severity": "medium",
      "description": "Module line counts in docs/architecture/orchestrator.md are significantly inaccurate: state_machine.py documented as ~100 (actual 248), step_runner.py documented as ~350 (actual 672).",
      "remediation": "Update the line counts in the modules table to reflect actual file sizes, or remove exact counts.",
      "auto_remediable": true
    },
    {
      "flag": "undocumented_cli_flag",
      "severity": "low",
      "description": "The --prompt flag for bin/auto-clear.sh is supported by the script but not mentioned in any documentation page.",
      "remediation": "Add --prompt flag documentation to at least one docs page (orchestrator.md or context-management.md).",
      "auto_remediable": true
    },
    {
      "flag": "inconsistent_python_invocation",
      "severity": "low",
      "description": "bin/auto-clear.sh uses 'python' on line 54 and 'python3' on line 55, which may fail on systems where 'python' is not available.",
      "remediation": "Use 'python3' consistently throughout the script, or add a PYTHON variable that resolves the correct interpreter.",
      "auto_remediable": true
    }
  ],
  "requires_human_review": false,
  "timestamp": "2026-03-02T15:30:00Z",
  "findings": [
    {
      "persona": "documentation/documentation-reviewer",
      "verdict": "request_changes",
      "confidence": 0.78,
      "rationale": "Architecture diagram in orchestrator.md uses ASCII box-drawing characters instead of mermaid — this is a blocking finding per documentation standards. Module line counts in the same file are inaccurate by 2x for two modules. Test count uses misleading '964+' notation. The --prompt flag for auto-clear.sh is undocumented in all docs pages.",
      "findings_count": {
        "critical": 0,
        "high": 1,
        "medium": 2,
        "low": 2,
        "info": 1
      }
    },
    {
      "persona": "documentation/documentation-writer",
      "verdict": "approve",
      "confidence": 0.72,
      "rationale": "Documentation accurately reflects the new orchestrator-driven model across all 7 files. The startup.md rewrite is clean and focused. Cross-references are consistent. However, significant operational detail from the old startup.md (validation rules, filtering criteria, platform-specific handoffs) was removed without documenting where this logic now lives. No migration guide exists for the prompt-chain to orchestrator transition.",
      "findings_count": {
        "critical": 0,
        "high": 0,
        "medium": 0,
        "low": 4,
        "info": 1
      }
    },
    {
      "persona": "specialist/api-consumer",
      "verdict": "approve",
      "confidence": 0.80,
      "rationale": "CLI protocol is well-documented with consistent examples across multiple files. StepResult action values are thoroughly enumerated. Exit code semantics and JSON output format are mentioned but could be more explicit. --session-id auto-resolution behavior is correct but undocumented.",
      "findings_count": {
        "critical": 0,
        "high": 0,
        "medium": 0,
        "low": 1,
        "info": 2
      }
    },
    {
      "persona": "leadership/mentor",
      "verdict": "approve",
      "confidence": 0.75,
      "rationale": "The step-based loop diagram is an excellent teaching tool. The request-response pattern is immediately understandable. However, no conceptual explanation exists for why prompt chaining was retired — the 'why' behind the architecture change is missing from documentation.",
      "findings_count": {
        "critical": 0,
        "high": 0,
        "medium": 0,
        "low": 1,
        "info": 1
      }
    },
    {
      "persona": "engineering/ux-engineer",
      "verdict": "approve",
      "confidence": 0.82,
      "rationale": "CLI subcommand design follows standard patterns with intuitive naming. Configuration defaults are sensible (project.yaml, auto session-id). Auto-clear wrapper is well-designed with backoff and retry cap. Minor issue with mixed python/python3 invocations in the script.",
      "findings_count": {
        "critical": 0,
        "high": 0,
        "medium": 0,
        "low": 1,
        "info": 1
      }
    }
  ],
  "aggregate_verdict": "request_changes",
  "execution_context": {
    "repository": "convergent-systems-co/dark-forge",
    "branch": "feat/retire-prompt-chaining",
    "commit_sha": "f3c7d18",
    "pr_number": 587,
    "policy_profile": "default",
    "triggered_by": "manual"
  }
}
