{
  "panel_name": "cost-analysis",
  "panel_version": "1.0.0",
  "confidence_score": 0.83,
  "risk_level": "negligible",
  "compliance_score": 0.95,
  "policy_flags": [],
  "requires_human_review": false,
  "timestamp": "2026-03-02T17:00:00Z",
  "findings": [
    {
      "persona": "finops/finops-analyst",
      "verdict": "approve",
      "confidence": 0.85,
      "rationale": "No production workload billing impact. Changes are dev-only tooling in a governance submodule. No showback/chargeback or unit cost metric changes. CI compute overhead is single-digit seconds per run.",
      "findings_count": {
        "critical": 0,
        "high": 0,
        "medium": 0,
        "low": 0,
        "info": 1
      }
    },
    {
      "persona": "finops/finops-engineer",
      "verdict": "approve",
      "confidence": 0.85,
      "rationale": "No new cloud resources to tag or budget. pytest-html is dev-only and does not enter production dependency trees. No commitment coverage or reservation implications.",
      "findings_count": {
        "critical": 0,
        "high": 0,
        "medium": 0,
        "low": 0,
        "info": 1
      }
    },
    {
      "persona": "operations/cost-optimizer",
      "verdict": "approve",
      "confidence": 0.84,
      "rationale": "Lowering Python floor preserves existing cached CI images. Self-contained HTML report adds 30-100 KB disk I/O per test run — negligible. Consider gating report generation behind CI-only flag for local development convenience.",
      "findings_count": {
        "critical": 0,
        "high": 0,
        "medium": 0,
        "low": 1,
        "info": 0
      }
    },
    {
      "persona": "finops/cloud-cost-analyst",
      "verdict": "approve",
      "confidence": 0.85,
      "rationale": "No IaC modifications. Zero incremental cloud resource cost across all environments. No egress, data transfer, or licensing implications.",
      "findings_count": {
        "critical": 0,
        "high": 0,
        "medium": 0,
        "low": 0,
        "info": 1
      }
    },
    {
      "persona": "finops/llm-cost-analyst",
      "verdict": "approve",
      "confidence": 0.82,
      "rationale": "Token budget impact is minimal. Generated HTML report could consume 500-2,000 tokens if accidentally read by an agentic session, but the file resides in tests/ which agents do not broadly scan. CI compute overhead for report generation is $0.01-0.05/month. Recommend adding report to .gitignore.",
      "findings_count": {
        "critical": 0,
        "high": 0,
        "medium": 0,
        "low": 1,
        "info": 1
      }
    },
    {
      "persona": "operations/infrastructure-engineer",
      "verdict": "approve",
      "confidence": 0.85,
      "rationale": "No infrastructure topology or scaling changes. Python 3.9 floor is backward-compatible. pytest-html is lightweight (~50 KB installed) with no native extensions.",
      "findings_count": {
        "critical": 0,
        "high": 0,
        "medium": 0,
        "low": 0,
        "info": 1
      }
    }
  ],
  "aggregate_verdict": "approve",
  "execution_context": {
    "repository": "convergent-systems-co/dark-forge",
    "branch": "feat/retire-prompt-chaining",
    "commit_sha": "f3c7d18b6d6af376cce384598ac37e905d5a5b9d",
    "pr_number": 587,
    "policy_profile": "default",
    "triggered_by": "manual"
  }
}
