{
  "panel_name": "incident-post-mortem",
  "panel_version": "1.0.0",
  "confidence_score": 0.85,
  "risk_level": "low",
  "compliance_score": 0.90,
  "policy_flags": [],
  "requires_human_review": true,
  "timestamp": "2026-02-25T00:00:00Z",
  "findings": [
    {
      "persona": "operations/sre",
      "verdict": "approve",
      "confidence": 0.85,
      "rationale": "Baseline emission — no active incidents. Panel evaluates post-incident remediation PRs for root cause coverage, contributing factors, and systemic improvements.",
      "findings_count": { "critical": 0, "high": 0, "medium": 0, "low": 0, "info": 0 }
    },
    {
      "persona": "operations/failure-engineer",
      "verdict": "approve",
      "confidence": 0.85,
      "rationale": "No failure modes to analyze in governance configuration changes. Resilience patterns unaffected.",
      "findings_count": { "critical": 0, "high": 0, "medium": 0, "low": 0, "info": 0 }
    }
  ],
  "aggregate_verdict": "approve",
  "execution_context": {
    "repository": "SET-Apps/ai-submodule",
    "policy_profile": "default",
    "model_version": "claude-opus-4-6",
    "triggered_by": "manual"
  }
}
