{
  "panel_name": "copilot-review",
  "panel_version": "1.0.0",
  "confidence_score": 0.80,
  "risk_level": "low",
  "compliance_score": 1.0,
  "policy_flags": [],
  "requires_human_review": false,
  "timestamp": "2026-02-25T00:00:00Z",
  "findings": [
    {
      "persona": "external/github-copilot",
      "verdict": "approve",
      "confidence": 0.80,
      "rationale": "Baseline emission — no Copilot findings on governance configuration changes. Clean review with no inline comments, review submissions, or issue-level comments from Copilot bots.",
      "findings_count": { "critical": 0, "high": 0, "medium": 0, "low": 0, "info": 0 }
    }
  ],
  "aggregate_verdict": "approve",
  "execution_context": {
    "repository": "SET-Apps/ai-submodule",
    "policy_profile": "default",
    "model_version": "claude-opus-4-6",
    "triggered_by": "manual"
  }
}
