{
  "panel_name": "architecture-review",
  "panel_version": "1.0.0",
  "confidence_score": 0.85,
  "risk_level": "low",
  "compliance_score": 0.90,
  "policy_flags": [],
  "requires_human_review": false,
  "timestamp": "2026-02-25T00:00:00Z",
  "findings": [
    {
      "persona": "architecture/systems-architect",
      "verdict": "approve",
      "confidence": 0.85,
      "rationale": "Baseline emission — governance configuration repo with no application architecture changes. Existing layered architecture (Intent, Cognitive, Execution, Runtime, Evolution) intact.",
      "findings_count": { "critical": 0, "high": 0, "medium": 0, "low": 0, "info": 0 }
    },
    {
      "persona": "domain/backend-engineer",
      "verdict": "approve",
      "confidence": 0.85,
      "rationale": "No backend service changes. Policy profiles and schema definitions follow existing patterns.",
      "findings_count": { "critical": 0, "high": 0, "medium": 0, "low": 0, "info": 0 }
    },
    {
      "persona": "operations/sre",
      "verdict": "approve",
      "confidence": 0.85,
      "rationale": "No operational impact. CI workflows unchanged. No new failure modes introduced.",
      "findings_count": { "critical": 0, "high": 0, "medium": 0, "low": 0, "info": 0 }
    }
  ],
  "aggregate_verdict": "approve",
  "execution_context": {
    "repository": "SET-Apps/ai-submodule",
    "policy_profile": "default",
    "model_version": "claude-opus-4-6",
    "triggered_by": "manual"
  }
}
