{
  "panel_name": "testing-review",
  "panel_version": "1.0.0",
  "confidence_score": 0.85,
  "risk_level": "low",
  "compliance_score": 1.0,
  "policy_flags": [],
  "requires_human_review": false,
  "timestamp": "2026-02-25T00:00:00Z",
  "findings": [
    {
      "persona": "quality/test-engineer",
      "verdict": "approve",
      "confidence": 0.85,
      "rationale": "Baseline emission — governance configuration repo contains no executable application code requiring test coverage. Panel evaluates coverage gaps, test quality, and testing infrastructure when test-relevant changes are present.",
      "findings_count": { "critical": 0, "high": 0, "medium": 0, "low": 0, "info": 0 }
    },
    {
      "persona": "quality/quality-engineer",
      "verdict": "approve",
      "confidence": 0.85,
      "rationale": "Schema validation serves as the test surface for governance artifacts. JSON Schema files validated against panel-output.schema.json.",
      "findings_count": { "critical": 0, "high": 0, "medium": 0, "low": 0, "info": 0 }
    }
  ],
  "aggregate_verdict": "approve",
  "execution_context": {
    "repository": "SET-Apps/ai-submodule",
    "policy_profile": "default",
    "model_version": "claude-opus-4-6",
    "triggered_by": "manual"
  }
}
